news_type,title,date,all_contents,contents,image_url,news_url,editor,press
today_main_news,"두 달 만에 만난 한일정상 ""강제동원 문제 속히 해결"" 재차 공감",2022-11-13,"尹대통령-기시다 ""외교당국 간 협의 가속화"" 평가
세부 이견은 아직 못 좁힌 듯… ""北도발 대응 협력""
윤석열 대통령(왼쪽)과 기시다 후미오 일본 총리. (대통령실 제공) 2022.9.23/뉴스1 ⓒ News1 오대일 기자


(서울=뉴스1) 노민호 기자 = 윤석열 대통령과 기시다 후미오(岸田文雄) 일본 총리가 2개월 만에 다시 마주했다. 두 정상은 한일 양국 간 최대 갈등 현안인 일제강점기 강제동원 피해배상 관련 해법에 대해서도 의견을 주고받으며 그 조속한 해결 필요성을 강조했다.

윤 대통령과 기시다 총리는 13일 동남아시아국가연합(ASEAN·아세안) 관련 정상회의가 열리고 있는 캄보디아 프놈펜에서 한일정상회담에 임했다. 두 정상의 만남은 지난 9월 유엔총회 참석을 계기로 미국 뉴욕에서 진행된 '약식' 회담 이후 약 2개월 만이다.

일본 외무성에 따르면 두 정상은 이날 회담에서 '옛 한반도 출신 노동자 문제', 즉 강제동원 피해자 문제와 관련해 9월 회담 당시 양측이 지시했던 대로 ""외교당국 간 협의가 가속화되고 있다""고 평가하고 ""이를 감안해 현안을 조속히 해결하기로"" 재차 합의했다.

일본 측은 앞서 강제동원 피해자 배상 문제가 1965년 한일청구권협정 체결 당시 우리 정부에 제공한 총 5억달러 상당의 유·무상 경제협력을 통해 ""이미 해결됐다""는 입장을 밝혀왔다.

그러나 올 들어 우리 대법원이 피해배상을 명령한 일본제철·미쓰비시(三菱)중공업 등 일본 기업들의 국내 자산 매각 및 현금화가 현실화될 기미를 보이자 우리 측 동향을 주시하며 당국 간 협의에도 응하고 있다.

우리 정부는 강제동원 피해배상 문제와 관련해 국내에서 공청회 등을 열어 추가적인 의견을 수렴하는 등의 절차를 검토 중이다.

그러나 우리 대통령실은 이날 회담 결과와 관련해 ""양국 간 현안의 조속한 해결을 위해 계속 협의해가자고 했다""고만 전했을 뿐 '현얀=강제동원 관련 문제'임을 명시하지 않아 그 배경에 관심이 모아진다.

이를 두고 일각에선 ""한일 당국 간 협의가 계속 진행되고 있긴 하나 여전히 좁혀야 할 부분이 많은 것 같다""는 등의 관측이 나오고 있다. 구체적으로 일본 기업들의 한국 내 자산 매각 외 방법으로 피해자에게 지급할 배상금 재원을 조성할 경우 해당 일본 기업들이 참여할지 여부와 피해자 측의 사과 요구에 일본 측이 호응할지 여부가 여전히 해법 도출의 걸림돌이 되고 있는 것으로 보인다.

윤석열 정부는 지난 5월 출범 이후 강제동원 피해배상 등 과거사 문제 해결과 더불어 미래지향적 한일관계 구축의 필요성을 꾸준히 강조해왔다. 기시다 내각 역시 양국관계 개선의 필요성 자체에 대해선 공감하고 있는 상황이다.

이런 가운데 두 정상은 이날 회담에서 북한의 최근 연이은 탄도미사일 발사 등 무력도발을 강력 규탄하면서 그 대응을 위해 한일 및 한미일 간에 긴밀히 협력해간다는 데 의견을 모았다고 한일 양측이 전했다.

북한은 올 들어 대륙간탄도미사일(ICBM) 시험발사를 재개한 것을 비롯해 전례 없이 높은 빈도로 무력도발을 감행해왔다. 현재는 제7차 핵실험 준비에 필요한 준비를 모두 마친 채 김정은 노동당 총비서의 '정치적 결단'만 기다리고 있는 것으로 평가되고 있다.

이와 관련 우리나라와 미국, 일본은 그동안 관계당국 간 협의를 통해 북한의 추가 핵실험 상황 등에 대비한 다양한 대응책을 협의해온 상황. 여기엔 3국 간 군사훈련과 더불어 유엔안전보장이사회 차원의 추가 제재 결의 추진, 그리고 북한의 핵·미사일 개발 자금원을 차단하기 위한 각국의 독자 제재 부과 및 상호 연계방안 등 포함된다.

특히 한미일은 북한이 암호화폐 거래·탈취 등을 통해 핵·미사일 개발 자금을 확보해왔단 판단에서 이를 차단하기 위한 방안들을 준비 중이다.

이외에도 두 정상은 이날 회담에서 윤 대통령이 지난 11일 한·동남아시아국가연합(ASEAN·아세안) 정상회의를 통해 기본 방향을 소개한 '자유·평화·번영의 인도·태평양 전략', 그리고 일본 정부가 내년 봄 새로 발표할 '자유롭고 열린 인도·태평양'(FOIP) 계획에 관한 의견을 나누고 앞으로 관련 분야 협력을 모색해가기로 했다.

양측은 한일 간 인적 교류 확대 등에 관해서도 의견을 나눴으며, 정상 간 소통 또한 계속해가기로 했다. 앞으로도 정상회담을 이어가겠단 의미다.

윤 대통령과 기시다 총리의 이날 회담은 당초 예정했던 것보다 15분 정도 길어진 약 45분 간 진행된 것으로 알려졌다.","尹대통령-기시다 ""외교당국 간 협의 가속화"" 평가 세부 이견은 아직 못 좁힌 듯… ""北도발 대응 협력"" 윤석열 대통령(왼쪽)과 기시다 후미오 일본 총리. (대통령실 제공) 2022.9.23/뉴스1 ⓒ News1 (서울=뉴스1) = 윤석열 대통령과 기시다 후미오(岸田文雄) 일본 총리가 2개월 만에 다시 마주했다. 두 정상은 한일 양국 간 최대 갈등 현안인 일제강점기 강제동원 피해배상 관련 해법에 대해서도 의견을 주고받으며 그 조속한 해결 필요성을 강조했다. 윤 대통령과 기시다 총리는 13일 동남아시아국가연합(ASEAN·아세안) 관련 정상회의가 열리고 있는 캄보디아 프놈펜에서 한일정상회담에 임했다. 두 정상의 만남은 지난 9월 유엔총회 참석을 계기로 미국 뉴욕에서 진행된 '약식' 회담 이후 약 2개월 만이다. 일본 외무성에 따르면 두 정상은 이날 회담에서 '옛 한반도 출신 노동자 문제', 즉 강제동원 피해자 문제와 관련해 9월 회담 당시 양측이 지시했던 대로 ""외교당국 간 협의가 가속화되고 있다""고 평가하고 ""이를 감안해 현안을 조속히 해결하기로"" 재차 합의했다. 일본 측은 앞서 강제동원 피해자 배상 문제가 1965년 한일청구권협정 체결 당시 우리 정부에 제공한 총 5억달러 상당의 유·무상 경제협력을 통해 ""이미 해결됐다""는 입장을 밝혀왔다. 그러나 올 들어 우리 대법원이 피해배상을 명령한 일본제철·미쓰비시(三菱)중공업 등 일본 기업들의 국내 자산 매각 및 현금화가 현실화될 기미를 보이자 우리 측 동향을 주시하며 당국 간 협의에도 응하고 있다. 우리 정부는 강제동원 피해배상 문제와 관련해 국내에서 공청회 등을 열어 추가적인 의견을 수렴하는 등의 절차를 검토 중이다. 그러나 우리 대통령실은 이날 회담 결과와 관련해 ""양국 간 현안의 조속한 해결을 위해 계속 협의해가자고 했다""고만 전했을 뿐 '현얀=강제동원 관련 문제'임을 명시하지 않아 그 배경에 관심이 모아진다. 이를 두고 일각에선 ""한일 당국 간 협의가 계속 진행되고 있긴 하나 여전히 좁혀야 할 부분이 많은 것 같다""는 등의 관측이 나오고 있다. 구체적으로 일본 기업들의 한국 내 자산 매각 외 방법으로 피해자에게 지급할 배상금 재원을 조성할 경우 해당 일본 기업들이 참여할지 여부와 피해자 측의 사과 요구에 일본 측이 호응할지 여부가 여전히 해법 도출의 걸림돌이 되고 있는 것으로 보인다. 윤석열 정부는 지난 5월 출범 이후 강제동원 피해배상 등 과거사 문제 해결과 더불어 미래지향적 한일관계 구축의 필요성을 꾸준히 강조해왔다. 기시다 내각 역시 양국관계 개선의 필요성 자체에 대해선 공감하고 있는 상황이다. 이런 가운데 두 정상은 이날 회담에서 북한의 최근 연이은 탄도미사일 발사 등 무력도발을 강력 규탄하면서 그 대응을 위해 한일 및 한미일 간에 긴밀히 협력해간다는 데 의견을 모았다고 한일 양측이 전했다. 북한은 올 들어 대륙간탄도미사일(ICBM) 시험발사를 재개한 것을 비롯해 전례 없이 높은 빈도로 무력도발을 감행해왔다. 현재는 제7차 핵실험 준비에 필요한 준비를 모두 마친 채 김정은 노동당 총비서의 '정치적 결단'만 기다리고 있는 것으로 평가되고 있다. 이와 관련 우리나라와 미국, 일본은 그동안 관계당국 간 협의를 통해 북한의 추가 핵실험 상황 등에 대비한 다양한 대응책을 협의해온 상황. 여기엔 3국 간 군사훈련과 더불어 유엔안전보장이사회 차원의 추가 제재 결의 추진, 그리고 북한의 핵·미사일 개발 자금원을 차단하기 위한 각국의 독자 제재 부과 및 상호 연계방안 등 포함된다. 특히 한미일은 북한이 암호화폐 거래·탈취 등을 통해 핵·미사일 개발 자금을 확보해왔단 판단에서 이를 차단하기 위한 방안들을 준비 중이다. 이외에도 두 정상은 이날 회담에서 윤 대통령이 지난 11일 한·동남아시아국가연합(ASEAN·아세안) 정상회의를 통해 기본 방향을 소개한 '자유·평화·번영의 인도·태평양 전략', 그리고 일본 정부가 내년 봄 새로 발표할 '자유롭고 열린 인도·태평양'(FOIP) 계획에 관한 의견을 나누고 앞으로 관련 분야 협력을 모색해가기로 했다. 양측은 한일 간 인적 교류 확대 등에 관해서도 의견을 나눴으며, 정상 간 소통 또한 계속해가기로 했다. 앞으로도 정상회담을 이어가겠단 의미다. 윤 대통령과 기시다 총리의 이날 회담은 당초 예정했던 것보다 15분 정도 길어진 약 45분 간 진행된 것으로 알려졌다.",https://imgnews.pstatic.net/image/421/2022/11/13/0006454441_001_20221113230801606.jpg?type=w647,https://n.news.naver.com/mnews/article/421/0006454441?sid=100,노민호 기자,뉴스1
today_main_news,‘오드리 헵번 코스프레?’...김건희 여사 심장병 어린이 방문에 野 정치인 등 맹비난,2022-11-13,"연합뉴스 온라인 커뮤니티 캡처


김용민 “고통받는 사람을 장식품처럼 활용하는 사악함 버려라”

황교익 “김건희 자신의 이미지를 세탁하기 위한 행보”

김연주 “당연히 껴안는 자세가 나올 수밖에 없어” 반박

윤석열 대통령의 동남아시아 순방에 동행한 김건희 여사가 선천성 심장질환을 앓고 있는 아이를 안고 있는 모습을 찍은 사진을 두고 야권 정치인 등이 맹비난을 퍼붓고 있다. 김 여사가 세계적 영화배우이자 자선사업가인 오드리 헵번을 따라 했다는 주장이다. 여권에서는 국내 연예인들도 해외 봉사활동에서 비슷한 구도로 사진을 찍었다며 반박하고 있다.

김용민 더불어민주당 의원은 13일 페이스북에 올린 글에서 “따라 하고 싶으면, 옷차림이나 포즈가 아니라 그들의 마음과 희생을 따라하라”며 “고통받는 사람들을 장식품처럼 활용하는 사악함부터 버리기 바란다”고 적었다. 명시적으로 비판 대상을 밝히지는 않았으나 김 여사를 겨냥한 것으로 보인다.

김 여사는 12일 캄보디아 프놈펜에서 심장 질환을 앓고 있는 A(14)군의 집을 찾았다. 사실 이날 김 여사는 정상회의에 동행한 정상 배우자 프로그램으로 앙코르와트 사원에 방문할 예정이었으나, 사원 일정 대신 A 군의 소년의 집을 찾았다. 전날 A 군은 김 여사가 찾은 캄보디아 수도 프놈펜의 헤브론 의료원에서 김 여사를 만날 예정이었으나, 건강 상태가 좋지 못해 병원에 오지 못했다. 이 사연을 접한 김 여사가 사원 일정 대신 A군의 집을 직접 방문한 것이다. 김 여사가 A 군의 집을 방문한 후, 대통령실은 김 여사가 A군을 안고 있는 사진을 공개했다.

김 의원 뿐 아니라 온라인에서는 김 여사가 사진 구도, 옷차림 등을 두고 오드리 헵번을 흉내 냈다는 비난이 쏟아지고 있다. 일부는 공식 일정을 취소하고 A 군 집에 방문한 것이 ‘외교적 결례’라고 지적한다.

야권 성향의 맛 칼럼니스트 황교익씨는 “각국 정상 배우자들은 회의 주최 국가의 의사를 존중하여 앙코르와트를 단체로 방문했는데, 대한민국 대통령 부인인 김건희만 혼자서 심장병 앓는 아이를 만나 오드리 헵번 코스프레를 했다”며 “캄보디아를 위한 것이 아니라 김건희 자신의 이미지를 세탁하기 위한 행보”라고 비판했다. 김진애 전 국회의원은 “대통령 배우자가 공식 일정을 거부한 게 외교 현장에서 가당하냐. 무슨 사진을 이렇게 많이 뿌리냐. 영부인은 공적 신분이지 셀럽이 아니다”라고 했다.

이에 국민의힘 상근부대변을 지낸 김연주 시사평론가는 “해도 너무한다”며 “왜 사진을 많이 뿌리냐며, 혹자는 봉사 활동을 했던 배우 오드리 헵번의 이미지로 연출한 것이 아니냐는 이야기까지 나오고 있다. 국제구호단체의 친선 대사를 지냈던 배우 김혜자씨, 정애리씨도 같은 구도의 사진이 여러 장 나와 있으니 참고하라”고 했다. 이어 “생활이나 의료 환경면에서 비교적 취약한 곳에 있는 어린이들은, 건강 상태가 좋지 않고 발육도 여의치 않아, 방문하게 되면 당연히 껴안는 자세가 나올 수밖에 없는 것인데, 이마저도 비판의 소재로 삼거나 혹은 비아냥의 대상으로 할 요량이면 어찌할 수 없는 것”이라고 했다.","연합뉴스 온라인 커뮤니티 캡처 김용민 “고통받는 사람을 장식품처럼 활용하는 사악함 버려라” 황교익 “김건희 자신의 이미지를 세탁하기 위한 행보” 김연주 “당연히 껴안는 자세가 나올 수밖에 없어” 반박 윤석열 대통령의 동남아시아 순방에 동행한 김건희 여사가 선천성 심장질환을 앓고 있는 아이를 안고 있는 모습을 찍은 사진을 두고 야권 정치인 등이 맹비난을 퍼붓고 있다. 김 여사가 세계적 영화배우이자 자선사업가인 오드리 헵번을 따라 했다는 주장이다. 여권에서는 국내 연예인들도 해외 봉사활동에서 비슷한 구도로 사진을 찍었다며 반박하고 있다. 김용민 더불어민주당 의원은 13일 페이스북에 올린 글에서 “따라 하고 싶으면, 옷차림이나 포즈가 아니라 그들의 마음과 희생을 따라하라”며 “고통받는 사람들을 장식품처럼 활용하는 사악함부터 버리기 바란다”고 적었다. 명시적으로 비판 대상을 밝히지는 않았으나 김 여사를 겨냥한 것으로 보인다. 김 여사는 12일 캄보디아 프놈펜에서 심장 질환을 앓고 있는 A(14)군의 집을 찾았다. 사실 이날 김 여사는 정상회의에 동행한 정상 배우자 프로그램으로 앙코르와트 사원에 방문할 예정이었으나, 사원 일정 대신 A 군의 소년의 집을 찾았다. 전날 A 군은 김 여사가 찾은 캄보디아 수도 프놈펜의 헤브론 의료원에서 김 여사를 만날 예정이었으나, 건강 상태가 좋지 못해 병원에 오지 못했다. 이 사연을 접한 김 여사가 사원 일정 대신 A군의 집을 직접 방문한 것이다. 김 여사가 A 군의 집을 방문한 후, 대통령실은 김 여사가 A군을 안고 있는 사진을 공개했다. 김 의원 뿐 아니라 온라인에서는 김 여사가 사진 구도, 옷차림 등을 두고 오드리 헵번을 흉내 냈다는 비난이 쏟아지고 있다. 일부는 공식 일정을 취소하고 A 군 집에 방문한 것이 ‘외교적 결례’라고 지적한다. 야권 성향의 맛 칼럼니스트 황교익씨는 “각국 정상 배우자들은 회의 주최 국가의 의사를 존중하여 앙코르와트를 단체로 방문했는데, 대한민국 대통령 부인인 김건희만 혼자서 심장병 앓는 아이를 만나 오드리 헵번 코스프레를 했다”며 “캄보디아를 위한 것이 아니라 김건희 자신의 이미지를 세탁하기 위한 행보”라고 비판했다. 김진애 전 국회의원은 “대통령 배우자가 공식 일정을 거부한 게 외교 현장에서 가당하냐. 무슨 사진을 이렇게 많이 뿌리냐. 영부인은 공적 신분이지 셀럽이 아니다”라고 했다. 이에 국민의힘 상근부대변을 지낸 김연주 시사평론가는 “해도 너무한다”며 “왜 사진을 많이 뿌리냐며, 혹자는 봉사 활동을 했던 배우 오드리 헵번의 이미지로 연출한 것이 아니냐는 이야기까지 나오고 있다. 국제구호단체의 친선 대사를 지냈던 배우 김혜자씨, 정애리씨도 같은 구도의 사진이 여러 장 나와 있으니 참고하라”고 했다. 이어 “생활이나 의료 환경면에서 비교적 취약한 곳에 있는 어린이들은, 건강 상태가 좋지 않고 발육도 여의치 않아, 방문하게 되면 당연히 껴안는 자세가 나올 수밖에 없는 것인데, 이마저도 비판의 소재로 삼거나 혹은 비아냥의 대상으로 할 요량이면 어찌할 수 없는 것”이라고 했다.",https://imgnews.pstatic.net/image/021/2022/11/13/0002541055_001_20221113232201081.jpg?type=w647,https://n.news.naver.com/mnews/article/021/0002541055?sid=100,조성진 기자,문화일보
