news_type,title,date,all_contents,contents,image_url,news_url,editor,press
today_main_news,"“여당이 장관도 못 지키나”…다시 뭉친 친윤, 목소리 키운다",2022-11-14,"국민의힘에서 한때 숨죽이고 있던 친윤계가 다시 움직이고 있다.

계기는 지난 8일 국회 운영위원회의 대통령실 국정감사장에서 강승규 시민사회수석과 김은혜 홍보수석이 퇴장당하면서부터다. 두 수석이 국감 도중 ‘웃기고 있네’라는 내용의 필담을 주고받은 것 때문에 운영위원장인 주호영 국민의힘 원내대표가 두 사람을 퇴장 조치하자 친윤계를 중심으로 “너무하다”는 불만이 쏟아져 나왔다.

장제원 의원은 10일 “의원들이 부글부글하더라”고 주 원내대표를 공개 비판했다. 대선 당시 윤석열 대통령 수행실장을 지낸 이용 의원도 같은 날 비공개 의원총회에서 “두 수석을 왜 퇴장시키나”라며 “여당이 윤 정부 뒷받침도 못 하고, 이상민 장관도 지켜주지 못하고 있다”는 취지로 비난했다고 한다.

대통령실이 동남아 순방에서 MBC 취재진을 대통령 전용기에 태우지 않겠다고 발표해 논란이 불거졌을 때는 MBC 출신인 배현진 의원이 “(MBC는) 자산이 많은 부자 회사이니 자사 취재진이 편안하게 민항기를 통해 순방을 다녀오도록 잘 지원할 거라 믿는다”는 페이스북 글을 올렸다. 당초 여당 내에서는 전용기 배제 방침에 “갑자기 (순방 이틀 전) 발표하는 것은 모양새가 좀 빠진다”(하태경 의원) 등 부정적 여론이 없지 않았다.

주말에는 친윤계 중진이 약속이라도 한 듯 이재명 더불어민주당 대표를 때렸다. 정진석 비대위원장은 13일 페이스북에 아태평화교류협회와 쌍방울의 대북 송금 의혹을 겨냥해 “유엔 제재까지 무시한 이재명의 대북 송금 스캔들”이라고 했고, 김기현 의원은 “이 대표의 남탓 행보가 갈수록 위선적이고 가식적”이라고 비난했다. 권성동 의원도 12일 “이 대표가 요즘 애도를 연기하고 있는데 위선이고 패륜”이라고 공격했다.

이같은 친윤계의 최근 행보에 대해 PK 지역 의원은 통화에서 “민주당은 이재명 대표가 사법리스크로 풍전등화인 상황에서도 원팀이 돼 공세를 펴고 있지 않나”라며 “왜 여당은 위기 때마다 같은 편 때리기에 몰두하는지 이해가 안 간다”고 지적했다.

친윤계의 목소리는 향후 당협 재정비, 전당대회와 맞물려 더 증폭될 가능성이 있다. 당장 차기 당 대표의 조건 중 하나로 ‘친윤’을 거론하는 목소리가 당에서 공개적으로 나오고 있다. 하지만 당권주자인 안철수 의원은 11일 라디오에서 두 수석의 국감장 퇴장에 대해 “적절하다고 본다”고 했고, 이상민 장관이 자진 사퇴해야 한다는 입장이다. 여권 관계자는 “전당대회가 본격화되면 친윤과 비윤의 갈등이 더 커질 것”이라고 전망했다.

Loading...
네이버 동영상 플레이어","국민의힘에서 한때 숨죽이고 있던 친윤계가 다시 움직이고 있다. 계기는 지난 8일 국회 운영위원회의 대통령실 국정감사장에서 강승규 시민사회수석과 김은혜 홍보수석이 퇴장당하면서부터다. 두 수석이 국감 도중 ‘웃기고 있네’라는 내용의 필담을 주고받은 것 때문에 운영위원장인 주호영 국민의힘 원내대표가 두 사람을 퇴장 조치하자 친윤계를 중심으로 “너무하다”는 불만이 쏟아져 나왔다. 장제원 의원은 10일 “의원들이 부글부글하더라”고 주 원내대표를 공개 비판했다. 대선 당시 윤석열 대통령 수행실장을 지낸 이용 의원도 같은 날 비공개 의원총회에서 “두 수석을 왜 퇴장시키나”라며 “여당이 윤 정부 뒷받침도 못 하고, 이상민 장관도 지켜주지 못하고 있다”는 취지로 비난했다고 한다. 대통령실이 동남아 순방에서 MBC 취재진을 대통령 전용기에 태우지 않겠다고 발표해 논란이 불거졌을 때는 MBC 출신인 배현진 의원이 “(MBC는) 자산이 많은 부자 회사이니 자사 취재진이 편안하게 민항기를 통해 순방을 다녀오도록 잘 지원할 거라 믿는다”는 페이스북 글을 올렸다. 당초 여당 내에서는 전용기 배제 방침에 “갑자기 (순방 이틀 전) 발표하는 것은 모양새가 좀 빠진다”(하태경 의원) 등 부정적 여론이 없지 않았다. 주말에는 친윤계 중진이 약속이라도 한 듯 이재명 더불어민주당 대표를 때렸다. 정진석 비대위원장은 13일 페이스북에 아태평화교류협회와 쌍방울의 대북 송금 의혹을 겨냥해 “유엔 제재까지 무시한 이재명의 대북 송금 스캔들”이라고 했고, 김기현 의원은 “이 대표의 남탓 행보가 갈수록 위선적이고 가식적”이라고 비난했다. 권성동 의원도 12일 “이 대표가 요즘 애도를 연기하고 있는데 위선이고 패륜”이라고 공격했다. 이같은 친윤계의 최근 행보에 대해 PK 지역 의원은 통화에서 “민주당은 이재명 대표가 사법리스크로 풍전등화인 상황에서도 원팀이 돼 공세를 펴고 있지 않나”라며 “왜 여당은 위기 때마다 같은 편 때리기에 몰두하는지 이해가 안 간다”고 지적했다. 친윤계의 목소리는 향후 당협 재정비, 전당대회와 맞물려 더 증폭될 가능성이 있다. 당장 차기 당 대표의 조건 중 하나로 ‘친윤’을 거론하는 목소리가 당에서 공개적으로 나오고 있다. 하지만 당권주자인 안철수 의원은 11일 라디오에서 두 수석의 국감장 퇴장에 대해 “적절하다고 본다”고 했고, 이상민 장관이 자진 사퇴해야 한다는 입장이다. 여권 관계자는 “전당대회가 본격화되면 친윤과 비윤의 갈등이 더 커질 것”이라고 전망했다. Loading... 네이버 동영상 플레이어",https://newsimg.sedaily.com/2019/01/23/1VE5F3W5WP_18.png,https://n.news.naver.com/mnews/article/025/0003238056?sid=100,손국희 기자,중앙일보
today_main_news,이상민 “폼나게 사표” 발언 파장…박홍근 “참사 심각성 못느끼나”,2022-11-14,"이상민 행정안전부 장관이 13일 오전 서울 종로구 정부서울청사에서 열린 이태원 사고 중앙재난안전대책본부 회의에 참석해 한덕수 국무총리(오른쪽)의 발언을 듣고 있다. [뉴시스]
이상민 행정안전부 장관의 “나도 폼나게 사표 내고 싶지 않겠냐”는 발언으로 논란을 낳고 있다.

앞서 이 장관은 지난 11일 문자 메시지를 통해 진행된 중앙일보와의 인터뷰에서 “누군들 폼 나게 사표 던지고 이 상황에서 벗어나고 싶지 않겠나”라며 “하지만 그건 국민에 대한 도리도, 고위공직자의 책임 있는 자세도 아니다”라고 밝혔다.

박홍근 더불어민주당 원내대표는 13일 중앙일보와의 통화에서 “이 장관이 이태원 참사에 대해 얼마나 가볍게 보는지 확연하게 드러난 발언”이라며 “이 장관의 그간 행태를 통해 참사에 대한 심각성을 느끼지 못하고 있다는 점을 알고 있다. 이젠 놀랍지도 않을 정도”라고 말했다. 박찬대 최고위원도 이날 통화에서 “책임을 느낀다면 윤석열 대통령의 눈치를 볼 것도 없이 사표를 내면 될 것 아니냐”며 “국민은 이 장관 발언에 대해 ‘엉뚱한 헛소리’라고 생각할 것”이라고 비판했다. 박지원 전 국가정보원장은 12일 페이스북에 “이 장관이 경찰의 총지휘자가 되었으면 이태원 참사에 대해 석고대죄해도 시원찮은 판국”이라며 “‘폼나게’ 사법처리 대상이 될 수 있으니 입 다물고 조용히 기다려라”고 적었다. 류호정 정의당 의원도 “정말 환장할 노릇이다. 파면으로 혼나야 한다”고 비판했다.

민주당은 아예 이태원 참사 국정조사를 추진하기 위한 동력으로 연결하고 있다. 당 관계자는 “국정조사에 대한 요구는 원래 민주당 지지층이 많았는데, 이 장관 발언에 대한 파장으로 중도층이 호응하기 시작했다”며 “하위직 공무원이 갑자기 극단적 선택을 하는 등 국민도 ‘뭔가 의아하다’는 느낌을 갖고 있어 국정조사에 탄력이 붙을 것”이라고 기대했다. 민주당은 ‘이태원 참사 국정조사 및 특검 추진을 위한 서명운동’을 지난 11일부터 벌이고 있다. 13일 오후 3시까지 23만686명(온라인 기준)이 서명에 참여했다.

민주당 관계자는 “여당이 국정조사 참여를 거부하고 있지만, 서명을 통해 국민 여론이 확인되면 김진표 국회의장도 여당을 제외한 채 특위를 구성하자고 할 것”이라며 “만약 여당이 특위 명단을 제출하지 않더라도 특위 구성에는 문제가 없을 것”이라고 설명했다.

하지만 민주당의 국정조사 요구가 이재명 대표 ‘방패막이용’이라는 비판도 만만치 않다. 양금희 국민의힘 수석대변인은 이날 중앙일보와의 통화에서 “민주당이 169석 의석으로 당장 김 의장을 압박할 수 있는 위치에 있는데도 장외투쟁에 더 몰두하고 있는 모습”이라며 “이는 이 대표의 사법리스크를 가리기 위한 것으로 이태원 참사 진상규명을 오히려 막을 뿐”이라고 지적했다.","이상민 행정안전부 장관이 13일 오전 서울 종로구 정부서울청사에서 열린 이태원 사고 중앙재난안전대책본부 회의에 참석해 한덕수 국무총리(오른쪽)의 발언을 듣고 있다. 이상민 행정안전부 장관의 “나도 폼나게 사표 내고 싶지 않겠냐”는 발언으로 논란을 낳고 있다. 앞서 이 장관은 지난 11일 문자 메시지를 통해 진행된 중앙일보와의 인터뷰에서 “누군들 폼 나게 사표 던지고 이 상황에서 벗어나고 싶지 않겠나”라며 “하지만 그건 국민에 대한 도리도, 고위공직자의 책임 있는 자세도 아니다”라고 밝혔다. 박홍근 더불어민주당 원내대표는 13일 중앙일보와의 통화에서 “이 장관이 이태원 참사에 대해 얼마나 가볍게 보는지 확연하게 드러난 발언”이라며 “이 장관의 그간 행태를 통해 참사에 대한 심각성을 느끼지 못하고 있다는 점을 알고 있다. 이젠 놀랍지도 않을 정도”라고 말했다. 박찬대 최고위원도 이날 통화에서 “책임을 느낀다면 윤석열 대통령의 눈치를 볼 것도 없이 사표를 내면 될 것 아니냐”며 “국민은 이 장관 발언에 대해 ‘엉뚱한 헛소리’라고 생각할 것”이라고 비판했다. 박지원 전 국가정보원장은 12일 페이스북에 “이 장관이 경찰의 총지휘자가 되었으면 이태원 참사에 대해 석고대죄해도 시원찮은 판국”이라며 “‘폼나게’ 사법처리 대상이 될 수 있으니 입 다물고 조용히 기다려라”고 적었다. 류호정 정의당 의원도 “정말 환장할 노릇이다. 파면으로 혼나야 한다”고 비판했다. 민주당은 아예 이태원 참사 국정조사를 추진하기 위한 동력으로 연결하고 있다. 당 관계자는 “국정조사에 대한 요구는 원래 민주당 지지층이 많았는데, 이 장관 발언에 대한 파장으로 중도층이 호응하기 시작했다”며 “하위직 공무원이 갑자기 극단적 선택을 하는 등 국민도 ‘뭔가 의아하다’는 느낌을 갖고 있어 국정조사에 탄력이 붙을 것”이라고 기대했다. 민주당은 ‘이태원 참사 국정조사 및 특검 추진을 위한 서명운동’을 지난 11일부터 벌이고 있다. 13일 오후 3시까지 23만686명(온라인 기준)이 서명에 참여했다. 민주당 관계자는 “여당이 국정조사 참여를 거부하고 있지만, 서명을 통해 국민 여론이 확인되면 김진표 국회의장도 여당을 제외한 채 특위를 구성하자고 할 것”이라며 “만약 여당이 특위 명단을 제출하지 않더라도 특위 구성에는 문제가 없을 것”이라고 설명했다. 하지만 민주당의 국정조사 요구가 이재명 대표 ‘방패막이용’이라는 비판도 만만치 않다. 양금희 국민의힘 수석대변인은 이날 중앙일보와의 통화에서 “민주당이 169석 의석으로 당장 김 의장을 압박할 수 있는 위치에 있는데도 장외투쟁에 더 몰두하고 있는 모습”이라며 “이는 이 대표의 사법리스크를 가리기 위한 것으로 이태원 참사 진상규명을 오히려 막을 뿐”이라고 지적했다.",https://imgnews.pstatic.net/image/025/2022/11/14/0003238068_001_20221114000213489.jpg?type=w647,https://n.news.naver.com/mnews/article/025/0003238068?sid=100,김효성 기자,중앙일보
today_main_news,"잦아든 '김은혜 퇴장' 갈등…與, 野 국정조사 드라이브에 결속",2022-11-14,"장제원·이용 등 친윤 일부 불만 토로
""찬반 상존, 친윤·비윤 구도는 아냐""
MBC·국정조사 등 현안에 與 결속 움직임
주호영, 당내 여론수렴 착수 전열 재정비
국민의힘 정진석 비대위원장과 주호영 원내대표가 2일 오전 서울 여의도 국회에서 열린 국민의힘 비상대책위원회의에서 대화를 하고 있다. ⓒ데일리안 홍금표 기자
[데일리안 = 정계성 기자] 주호영 국민의힘 원내대표의 김은혜·강승규 수석 퇴장 조치를 계기로 친윤과 비윤의 갈등이 다시 나타나는 게 아니냐는 분석이 나왔다. 친윤 핵심으로 통하는 장제원 의원이 공개적으로 주 원내대표를 비판하고 나섰다는 이유에서다. 일각에서는 윤석열 대통령의 의중이 투영된 게 아니냐는 말도 나왔다.

앞서 10일 장 의원은 취재진과 만나 ""의원들이 부글부글 하더라""고 전하며 ""필담을 갖고 두 번을 세워서 사과시켰다. 벌을 두 번 준 거다. 대통령의 수석 참모가 아닌가. (주 원내대표가) 퇴장까지 할 필요가 있었는지 (의문)”이라고 했었다. 초선인 이용 의원이 의원총회 자리에서 중진인 주 원내대표를 겨냥해 ""너무하다""며 직격하는 일도 있었다.

일부 언론에서는 윤 대통령이 직접 친윤 의원들에게 전화를 걸어 당의 대응에 불만을 토로했다는 보도도 나왔다. 이상민 행정안전부 장관 사퇴 등 현안에서 야당의 공세는 제대로 막아 내지 못하고, 되려 해명하고 사과한 두 수석을 퇴장 조치까지 했다는 게 요지다.

이를 계기로 국민의힘 내부의 틈을 더욱 벌리려는 민주당의 메시지도 나왔다. 박홍근 민주당 원내대표는 13일 자신의 페이스북을 통해 ""최근 대통령의 친위부대인 윤핵관들이 무슨 지시를 받았는지 서로 뒤질세라 자당 원내지도부마저 거칠게 공격하고 있다""며 ""여당 소속 의원들한테도 역정을 내는 적반하장식 태도에 말문이 막힐 지경""이라고 말했다.

주 원내대표의 퇴장 조치에 대해 당내 찬반 의견이 있는 것은 사실이지만, 조직적 '흔들기'나 친윤과 비윤의 갈등 구도는 아니라는 게 지배적인 분위기다. 실제 장 의원 외에 친윤으로 분류되는 주요 인사들의 공개 의견 표명이나 행동은 특별히 감지되지 않았다. 주 원내대표는 ""누구나 생각이 다를 수 있다""면서 ""(퇴장한 배경에) 말 못 할 사정들이 있다""고 확대해석을 경계했다.

윤 대통령이 일부 의원에게 전화를 걸어 불만을 표했다는 것도 확인되지 않았다. 정진석 위원장은 ""저는 전화를 받은 바 없다. 친윤계가 아닌 것 같다""고 반어적으로 말했고, 성일종 정책위의장은 ""대통령이 당에서 하는 자잘한 것까지 전화하는 분이 아니다""고 일축했다. 장 의원도 ""(보도에서 나온) '매가리'는 대통령이 사용하는 말이 아니다""며 ""가짜뉴스""라고 못을 박았다.

오히려 MBC의 전용기 탑승 배제 논란이 불거지자 적극적으로 방어에 나서는 등 일치된 모습을 보여주고 있다는 평가다. 물론 유승민 전 의원이나 하태경 의원 등 일부 비판적인 의견이 없진 않았으나, 당 지도부는 물론이고 주요 인사들이 일제히 나서 ""취재 거부가 아니다""라고 엄호해 혼선은 잦아들었다.

배현진 의원이 ""취재 거부가 아닌 편의 제공 취소""라며 총대를 멨고, 안철수 의원은 ""MBC에 대한 일종의 경고성 조치""라고 부연했다. 홍준표 대구시장은 ""취재의 자유가 있다면 취재 거부의 자유도 있다""고 대통령실에 힘을 실어줬고, 김기현 의원은 나아가 ""현 간부들이 유지되는 한 MBC는 해체가 맞다""며 MBC와 날을 세웠다.

특히 민주당이 이태원 참사 국정조사 여론전에 들어가면서 국민의힘도 더욱 결속력을 끌어올리는 형국이다. 주 원내대표는 14일 중진의원들과 비공개 간담회를 시작으로 당내 여론 수렴에 들어간다. 이태원 참사 대응이 주요 안건이지만, 다양한 현안에 대한 의견 청취를 통해 당내 파열음을 막고 심기일전의 각오를 다지는 자리가 될 것으로 보인다.","장제원·이용 등 친윤 일부 불만 토로 ""찬반 상존, 친윤·비윤 구도는 아냐"" MBC·국정조사 등 현안에 與 결속 움직임 주호영, 당내 여론수렴 착수 전열 재정비 국민의힘 정진석 비대위원장과 주호영 원내대표가 2일 오전 서울 여의도 국회에서 열린 국민의힘 비상대책위원회의에서 대화를 하고 있다. ⓒ데일리안 주호영 국민의힘 원내대표의 김은혜·강승규 수석 퇴장 조치를 계기로 친윤과 비윤의 갈등이 다시 나타나는 게 아니냐는 분석이 나왔다. 친윤 핵심으로 통하는 장제원 의원이 공개적으로 주 원내대표를 비판하고 나섰다는 이유에서다. 일각에서는 윤석열 대통령의 의중이 투영된 게 아니냐는 말도 나왔다. 앞서 10일 장 의원은 취재진과 만나 ""의원들이 부글부글 하더라""고 전하며 ""필담을 갖고 두 번을 세워서 사과시켰다. 벌을 두 번 준 거다. 대통령의 수석 참모가 아닌가. (주 원내대표가) 퇴장까지 할 필요가 있었는지 (의문)”이라고 했었다. 초선인 이용 의원이 의원총회 자리에서 중진인 주 원내대표를 겨냥해 ""너무하다""며 직격하는 일도 있었다. 일부 언론에서는 윤 대통령이 직접 친윤 의원들에게 전화를 걸어 당의 대응에 불만을 토로했다는 보도도 나왔다. 이상민 행정안전부 장관 사퇴 등 현안에서 야당의 공세는 제대로 막아 내지 못하고, 되려 해명하고 사과한 두 수석을 퇴장 조치까지 했다는 게 요지다. 이를 계기로 국민의힘 내부의 틈을 더욱 벌리려는 민주당의 메시지도 나왔다. 박홍근 민주당 원내대표는 13일 자신의 페이스북을 통해 ""최근 대통령의 친위부대인 윤핵관들이 무슨 지시를 받았는지 서로 뒤질세라 자당 원내지도부마저 거칠게 공격하고 있다""며 ""여당 소속 의원들한테도 역정을 내는 적반하장식 태도에 말문이 막힐 지경""이라고 말했다. 주 원내대표의 퇴장 조치에 대해 당내 찬반 의견이 있는 것은 사실이지만, 조직적 '흔들기'나 친윤과 비윤의 갈등 구도는 아니라는 게 지배적인 분위기다. 실제 장 의원 외에 친윤으로 분류되는 주요 인사들의 공개 의견 표명이나 행동은 특별히 감지되지 않았다. 주 원내대표는 ""누구나 생각이 다를 수 있다""면서 ""(퇴장한 배경에) 말 못 할 사정들이 있다""고 확대해석을 경계했다. 윤 대통령이 일부 의원에게 전화를 걸어 불만을 표했다는 것도 확인되지 않았다. 정진석 위원장은 ""저는 전화를 받은 바 없다. 친윤계가 아닌 것 같다""고 반어적으로 말했고, 성일종 정책위의장은 ""대통령이 당에서 하는 자잘한 것까지 전화하는 분이 아니다""고 일축했다. 장 의원도 ""(보도에서 나온) '매가리'는 대통령이 사용하는 말이 아니다""며 ""가짜뉴스""라고 못을 박았다. 오히려 MBC의 전용기 탑승 배제 논란이 불거지자 적극적으로 방어에 나서는 등 일치된 모습을 보여주고 있다는 평가다. 물론 유승민 전 의원이나 하태경 의원 등 일부 비판적인 의견이 없진 않았으나, 당 지도부는 물론이고 주요 인사들이 일제히 나서 ""취재 거부가 아니다""라고 엄호해 혼선은 잦아들었다. 배현진 의원이 ""취재 거부가 아닌 편의 제공 취소""라며 총대를 멨고, 안철수 의원은 ""MBC에 대한 일종의 경고성 조치""라고 부연했다. 홍준표 대구시장은 ""취재의 자유가 있다면 취재 거부의 자유도 있다""고 대통령실에 힘을 실어줬고, 김기현 의원은 나아가 ""현 간부들이 유지되는 한 MBC는 해체가 맞다""며 MBC와 날을 세웠다. 특히 민주당이 이태원 참사 국정조사 여론전에 들어가면서 국민의힘도 더욱 결속력을 끌어올리는 형국이다. 주 원내대표는 14일 중진의원들과 비공개 간담회를 시작으로 당내 여론 수렴에 들어간다. 이태원 참사 대응이 주요 안건이지만, 다양한 현안에 대한 의견 청취를 통해 당내 파열음을 막고 심기일전의 각오를 다지는 자리가 될 것으로 보인다.",https://imgnews.pstatic.net/image/119/2022/11/14/0002657419_001_20221114000001382.jpeg?type=w647,https://n.news.naver.com/mnews/article/119/0002657419?sid=100,정계성 기자,데일리안
