news_type,title,date,all_contents,contents,image_url,news_url,editor,press
today_main_news,“오드리 헵번 코스프레 말길”…심장병 소년 안은 김건희 여사에 野 맹비난,2022-11-13,"김진애 “영부인은 공적 신분이지 셀럽 아냐”
황교익 “자신의 이미지 세탁하기 위한 행보”

윤석열 대통령 부인 김건희 여사가 12일(현지시각) 캄보디아 프놈펜에서 선천성 심장질환을 앓고 있는 소년을 안고 있는 사진(왼쪽)과 영화배우 오드리 헵번이 소말리아 봉사 활동에서 영양실조 어린이를 안고 있는 사진. 대통령실 제공·온라인 커뮤니티 갈무리
 
윤석열 대통령의 동남아 순방에 동행한 김건희 여사가 선천성 심장질환을 앓고 있는 아이를 안고 있는 사진이 공개되자 야권을 중심으로 영화배우이자 자선 사업가인 오드리 헵번을 따라했다는 지적이 일고 있다.
 
김용민 더불어민주당 의원은 13일 페이스북을 통해 “따라 하고 싶으면, 옷차림이나 포즈가 아니라 그들의 마음과 희생을 따라하라”며 “고통받는 사람들을 장식품처럼 활용하는 사악함부터 버리기 바란다”고 적었다. 비판 대상을 밝히지는 않았으나 김 여사를 겨냥한 것으로 보인다.
 
김 여사는 전날 캄보디아 수도 프놈펜에서 심장 질환을 앓고 있는 A(14)군의 집을 방문했다. 이날 김 여사는 정상회의에 동행한 정상 배우자 프로그램으로 앙코르와트 사원에 방문할 예정이었으나, 사원 일정 대신 A군의 집을 찾았다. A군은 김 여사가 찾은 프놈펜의 헤브론 의료원에서 김 여사를 만날 예정이었으나, 건강 상태가 좋지 못해 병원에 오지 못했다. 이 사연을 접한 김 여사가 A군의 집을 직접 방문했고, 이후 대통령실은 김 여사가 A군을 안고 있는 사진을 공개했다.
 
사진 공개 직후 야권 성향의 정치인 등을 중심으로 김 여사가 사진 구도, 옷차림 등 오드리 헵번의 사진을 따라한 게 아니냐는 주장이 나왔다. 또 공식 일정을 취소하고 A군 집에 방문한 것이 외교적 결례라는 지적도 있었다.
윤석열 대통령 부인 김건희 여사가 12일(현지시간) 캄보디아 프놈펜의 한 선천성 심장질환을 앓고 있는 어린이의 집을 찾아 건강 상태를 살피고 가족들을 위로하고 있다. 대통령실 제공
 
사진 속 김 여사는 묶은 머리에 검은색 반팔 상의를 입고 두 팔로 A군을 안은 채 어딘가를 응시하고 있다. 해당 사진과 비교되고 있는 오드리 헵번의 사진은 1992년 소말리아 바이도아 소재 유니세프급식센터에서 촬영된 것으로, 그녀 역시 영양실조 아동을 안고 한 곳을 바라보고 있다.
 
맛 칼럼니스트 황교익씨는 “각국 정상 배우자들은 회의 주최 국가의 의사를 존중하여 앙코르와트를 단체로 방문했는데, 대한민국 대통령 부인인 김건희만 혼자서 심장병 앓는 아이를 만나 오드리 헵번 코스프레를 했다”며 “캄보디아를 위한 것이 아니라 김건희 자신의 이미지를 세탁하기 위한 행보”라고 비판했다.
 
김진애 전 국회의원도 “대통령 배우자가 공식 일정을 거부한 게 외교 현장에서 가당하냐. 무슨 사진을 이렇게 많이 뿌리냐”며 “영부인은 공적 신분이지 셀럽이 아니다”라고 했다.
 
한편 이 같은 지적에 국민의힘 상근부대변을 지낸 김연주 시사평론가는 “해도 너무한다”며 “왜 사진을 많이 뿌리냐며, 혹자는 봉사 활동을 했던 배우 오드리 헵번의 이미지로 연출한 것이 아니냐는 이야기까지 나오고 있다. 국제구호단체의 친선 대사를 지냈던 배우 김혜자씨, 정애리씨도 같은 구도의 사진이 여러 장 나와 있으니 참고하라”고 반박했다.
 
이어 “생활이나 의료 환경면에서 비교적 취약한 곳에 있는 어린이들은, 건강 상태가 좋지 않고 발육도 여의치 않아, 방문하게 되면 당연히 껴안는 자세가 나올 수밖에 없는 것인데, 이마저도 비판의 소재로 삼거나 혹은 비아냥의 대상으로 할 요량이면 어찌할 수 없는 것”이라고 했다.","김진애 “영부인은 공적 신분이지 셀럽 아냐” 황교익 “자신의 이미지 세탁하기 위한 행보” 윤석열 대통령 부인 김건희 여사가 12일(현지시각) 캄보디아 프놈펜에서 선천성 심장질환을 앓고 있는 소년을 안고 있는 사진(왼쪽)과 영화배우 오드리 헵번이 소말리아 봉사 활동에서 영양실조 어린이를 안고 있는 사진. 대통령실 제공·온라인 커뮤니티 갈무리 윤석열 대통령의 동남아 순방에 동행한 김건희 여사가 선천성 심장질환을 앓고 있는 아이를 안고 있는 사진이 공개되자 야권을 중심으로 영화배우이자 자선 사업가인 오드리 헵번을 따라했다는 지적이 일고 있다. 김용민 더불어민주당 의원은 13일 페이스북을 통해 “따라 하고 싶으면, 옷차림이나 포즈가 아니라 그들의 마음과 희생을 따라하라”며 “고통받는 사람들을 장식품처럼 활용하는 사악함부터 버리기 바란다”고 적었다. 비판 대상을 밝히지는 않았으나 김 여사를 겨냥한 것으로 보인다. 김 여사는 전날 캄보디아 수도 프놈펜에서 심장 질환을 앓고 있는 A(14)군의 집을 방문했다. 이날 김 여사는 정상회의에 동행한 정상 배우자 프로그램으로 앙코르와트 사원에 방문할 예정이었으나, 사원 일정 대신 A군의 집을 찾았다. A군은 김 여사가 찾은 프놈펜의 헤브론 의료원에서 김 여사를 만날 예정이었으나, 건강 상태가 좋지 못해 병원에 오지 못했다. 이 사연을 접한 김 여사가 A군의 집을 직접 방문했고, 이후 대통령실은 김 여사가 A군을 안고 있는 사진을 공개했다. 사진 공개 직후 야권 성향의 정치인 등을 중심으로 김 여사가 사진 구도, 옷차림 등 오드리 헵번의 사진을 따라한 게 아니냐는 주장이 나왔다. 또 공식 일정을 취소하고 A군 집에 방문한 것이 외교적 결례라는 지적도 있었다. 윤석열 대통령 부인 김건희 여사가 12일(현지시간) 캄보디아 프놈펜의 한 선천성 심장질환을 앓고 있는 어린이의 집을 찾아 건강 상태를 살피고 가족들을 위로하고 있다. 대통령실 제공 사진 속 김 여사는 묶은 머리에 검은색 반팔 상의를 입고 두 팔로 A군을 안은 채 어딘가를 응시하고 있다. 해당 사진과 비교되고 있는 오드리 헵번의 사진은 1992년 소말리아 바이도아 소재 유니세프급식센터에서 촬영된 것으로, 그녀 역시 영양실조 아동을 안고 한 곳을 바라보고 있다. 맛 칼럼니스트 황교익씨는 “각국 정상 배우자들은 회의 주최 국가의 의사를 존중하여 앙코르와트를 단체로 방문했는데, 대한민국 대통령 부인인 김건희만 혼자서 심장병 앓는 아이를 만나 오드리 헵번 코스프레를 했다”며 “캄보디아를 위한 것이 아니라 김건희 자신의 이미지를 세탁하기 위한 행보”라고 비판했다. 김진애 전 국회의원도 “대통령 배우자가 공식 일정을 거부한 게 외교 현장에서 가당하냐. 무슨 사진을 이렇게 많이 뿌리냐”며 “영부인은 공적 신분이지 셀럽이 아니다”라고 했다. 한편 이 같은 지적에 국민의힘 상근부대변을 지낸 김연주 시사평론가는 “해도 너무한다”며 “왜 사진을 많이 뿌리냐며, 혹자는 봉사 활동을 했던 배우 오드리 헵번의 이미지로 연출한 것이 아니냐는 이야기까지 나오고 있다. 국제구호단체의 친선 대사를 지냈던 배우 김혜자씨, 정애리씨도 같은 구도의 사진이 여러 장 나와 있으니 참고하라”고 반박했다. 이어 “생활이나 의료 환경면에서 비교적 취약한 곳에 있는 어린이들은, 건강 상태가 좋지 않고 발육도 여의치 않아, 방문하게 되면 당연히 껴안는 자세가 나올 수밖에 없는 것인데, 이마저도 비판의 소재로 삼거나 혹은 비아냥의 대상으로 할 요량이면 어찌할 수 없는 것”이라고 했다.",https://imgnews.pstatic.net/image/022/2022/11/13/20221113510656_20221114005202444.jpg?type=w647,https://n.news.naver.com/mnews/article/022/0003753742?sid=100,김수연 기자,세계일보
today_main_news,與 “유족 동의 없이 故人 사진 유포땐 형사 처벌”,2022-11-13,"고인(故人)의 사진이나 영상을 유족 동의 없이 유포한 사람을 형사 처벌하는 내용의 법안이 발의된다.

홍석준 국민의힘 의원이 지난 9월 21일 오후 서울 여의도 국회 본회의장에서 열린 제400회 국회(정기회) 제5차 본회의 대정부 질문(경제분야)에서 발언을 하고 있다./국회사진기자단

국민의힘 홍석준 의원은 13일 “사망자의 사진이나 영상을 무단으로 유포한 경우 ‘2년 이하의 징역이나 금고 또는 500만원 이하의 벌금에 처한다’는 신설 조항을 담은 형법 개정안을 14일 대표 발의하겠다”고 밝혔다. 홍 의원은 “‘이태원 핼러윈 참사’ 관련 사진과 영상이 소셜미디어를 통해 여과 없이 유포돼 고인의 명예 훼손과 유족에 대한 2차 피해 등이 벌어지고 있는데도 유포자를 처벌할 법적 근거가 없다”며 “이를 보완할 조속한 법 개정이 이뤄져야 한다”고 했다. 형법에는 ‘사자(死者) 명예훼손죄’가 규정돼 있지만, ‘공연히 허위의 사실을 적시’한 경우만 처벌 대상이 된다.

이 법이 통과되면 이태원 참사 희생자들의 얼굴 사진을 유족 동의 없이 공개할 수 없게 된다. 앞서 더불어민주당 일각에서는 “이태원 참사 희생자 명단과 사진을 공개해 추모 공간을 만들어야 한다”는 주장이 제기돼 논란이 일었다. 민주당 이재명 대표는 지난 9일 “유족들이 반대하지 않는 한 이름과 영정을 당연히 공개하고 진지한 애도가 있어야 한다”고 했다. 하지만 상당수 유족은 이름과 사진 공개를 원치 않는 것으로 알려졌다.

방송통신심의위원회가 홍 의원에게 제출한 자료를 보면, 방심위는 지난달 29일 이태원 참사 발생 직후부터 이달 10일까지 참사 당시 현장과 희생자 얼굴 등이 찍힌 인터넷 게시물 84건에 대해 삭제나 접속 차단 조치를 했다. 홍 의원은 “삭제와 접속 차단만으로는 유포를 근본적으로 막기 어렵다”며 “유포자를 처벌할 수 있도록 법을 바꿔야 한다”고 했다.","고인(故人)의 사진이나 영상을 유족 동의 없이 유포한 사람을 형사 처벌하는 내용의 법안이 발의된다. 홍석준 국민의힘 의원이 지난 9월 21일 오후 서울 여의도 국회 본회의장에서 열린 제400회 국회(정기회) 제5차 본회의 대정부 질문(경제분야)에서 발언을 하고 있다./국회사진기자단 국민의힘 홍석준 의원은 13일 “사망자의 사진이나 영상을 무단으로 유포한 경우 ‘2년 이하의 징역이나 금고 또는 500만원 이하의 벌금에 처한다’는 신설 조항을 담은 형법 개정안을 14일 대표 발의하겠다”고 밝혔다. 홍 의원은 “‘이태원 핼러윈 참사’ 관련 사진과 영상이 소셜미디어를 통해 여과 없이 유포돼 고인의 명예 훼손과 유족에 대한 2차 피해 등이 벌어지고 있는데도 유포자를 처벌할 법적 근거가 없다”며 “이를 보완할 조속한 법 개정이 이뤄져야 한다”고 했다. 형법에는 ‘사자(死者) 명예훼손죄’가 규정돼 있지만, ‘공연히 허위의 사실을 적시’한 경우만 처벌 대상이 된다. 이 법이 통과되면 이태원 참사 희생자들의 얼굴 사진을 유족 동의 없이 공개할 수 없게 된다. 앞서 더불어민주당 일각에서는 “이태원 참사 희생자 명단과 사진을 공개해 추모 공간을 만들어야 한다”는 주장이 제기돼 논란이 일었다. 민주당 이재명 대표는 지난 9일 “유족들이 반대하지 않는 한 이름과 영정을 당연히 공개하고 진지한 애도가 있어야 한다”고 했다. 하지만 상당수 유족은 이름과 사진 공개를 원치 않는 것으로 알려졌다. 방송통신심의위원회가 홍 의원에게 제출한 자료를 보면, 방심위는 지난달 29일 이태원 참사 발생 직후부터 이달 10일까지 참사 당시 현장과 희생자 얼굴 등이 찍힌 인터넷 게시물 84건에 대해 삭제나 접속 차단 조치를 했다. 홍 의원은 “삭제와 접속 차단만으로는 유포를 근본적으로 막기 어렵다”며 “유포자를 처벌할 수 있도록 법을 바꿔야 한다”고 했다.",https://imgnews.pstatic.net/image/023/2022/11/13/0003728142_001_20221114011101085.jpg?type=w647,https://n.news.naver.com/mnews/article/023/0003728142?sid=100,김승재 기자,조선일보
today_main_news,"""너무 음산, 장승곡 아냐""…SBS 尹순방 보도영상 음악 논란, 왜?",2022-11-13,"[서울경제]

SBS가 윤석열 대통령의 동남아 순방 보도를 전하면서 사용한 배경음악을 두고 논란이 일었다. 특히 여당 지지자들 사이에서 불만이 제기됐다. 전체적인 선율이 무거운 분위기인데다 노래 제목이 연극에서 최후의 막을 뜻하는 ‘휘날레(피날레)’인 점 등이 순방과는 전혀 어울리지 않는다는 지적이다.

13일 국민의힘 지지자들이 모인 온라인 커뮤니티엔 SBS뉴스 유튜브 채널에 올라온 ‘주영진의 뉴스브리핑’ 영상을 신고했다는 글이 잇따라 올라왔다. 지지자들이 문제 삼은 건 지난 10일 방송된 뉴스 오프닝으로, 가수 250의 ‘휘날레’란 곡을 배경으로 대통령실이 윤 대통령의 동남아시아 순방에 MBC 기자들의 대통령 전용기 탑승을 허용하지 않았단 내용이 다뤄졌다.

/SBS 공식 유튜브 캡쳐


오프닝엔 MBC가 윤 대통령의 비속어 논란을 보도했다가 여당과 대통령 측으로부터 항의를 받았단 내용도 포함됐다. 이 부분에는 ‘오늘이 그날인 것 같아. 우리가 전부였던 시간’이란 가사가 자막으로 등장했다. 또 윤 대통령과 김건희 여사가 전용기에 올라타 손을 흔드는 장면을 비롯한 여러 장면들이 흑백으로 편집됐다.

지지자들은 배경음악의 전체적인 분위기가 음산하다고 지적했다. 이들은 “추모영상에서나 쓰는 영상 기법을 왜 해외순방 가는 대통령 영상에 사용한 건지 의도가 명확해 보인다” “장송곡이 나와서 소름끼친다” 등의 반응을 보였다. 또 평소 ‘주영진의 뉴스브리핑’에서 배경음악 가사에 의미를 부여해온 점을 미뤄 “bgm 선정이 우연은 아닐 것” “휘날레란 제목도 의미가 있어 보인다” 등 반응이 나왔다.

유튜브에 올라온 해당 영상의 댓글에는 국민의힘 지지자들 사이에서 논란이 된 것과 마찬가지로 ""배경음악 왜 이러냐"" ""배경음악 소름 끼쳐. 이상하네"" 등의 반응이 올라왔다. 반면 ""오프닝 음악 좋다"" ""배경음악이 아주 잘 어울린다""는 반응도 있었다.

/SBS 공식 유튜브 캡쳐


해당 배경음악은 가수 250이 지난 3월 낸 앨범 ‘뽕’에 수록된 곡이다. 영상 자막으로 쓰인 ‘오늘이 그 날인 것 같아. 우리가 전부였던 시간’은 물론 ‘이제는 너를 볼 수 없는데. 그 추억들은’이라는 가사가 여러 차례 반복된다. 또 ‘그때 우리는 함께 눈이 부신 5월의 숲길을 걷고 있었지’ ‘기다리고 있었나 봐. 우리가 눈 맞추던 자리. 그 곳에 자꾸만 너를 데려와’ 등 추억을 회상하는 내용이 담겼다.

윤석열 대통령과 김건희 여사가 한·아세안 정상회의 등의 일정을 마친 뒤 주요 20개국(G20) 정상회의가 열리는 인도네시아 발리로 출국하기 위해 13일(현지시간) 캄보디아 프놈펜국제공항에 도착, 공군 1호기에서 인사하고 있다. /연합뉴스


한편 윤석열 대통령과 조 바이든 미국 대통령, 기시다 후미오 일본 총리는 13일(현지 시간) 북한의 핵과 미사일 위협에 대응해 확장 억제를 강화하기 위한 공동성명을 채택했다.

한미일 정상은 이날 동남아국가연합(ASEAN·아세안) 정상회의 참석차 방문한 캄보디아 프놈펜에서 3각 연쇄회담을 통해 대북 압박 수위를 최고조로 끌어올렸다.

한미일 정상이 한날 한자리에서 릴레이 회동한 것은 좀처럼 보기 힘든 일이다.

정상회담 직후 3국 정상은 △북핵에 대응한 확장 억제 강화 △북한 미사일 정보 공유 의향 표명 △3국 경제안보대화체 신설 △경제적 강압에 대응하기 위한 3국 연대 △한국의 인도태평양 전략에 대한 미일 지지 △공급망 등에서의 3국 협력 강화 등을 추진한다는 내용의 공동성명을 발표했다.","SBS가 윤석열 대통령의 동남아 순방 보도를 전하면서 사용한 배경음악을 두고 논란이 일었다. 특히 여당 지지자들 사이에서 불만이 제기됐다. 전체적인 선율이 무거운 분위기인데다 노래 제목이 연극에서 최후의 막을 뜻하는 ‘휘날레(피날레)’인 점 등이 순방과는 전혀 어울리지 않는다는 지적이다. 13일 국민의힘 지지자들이 모인 온라인 커뮤니티엔 SBS뉴스 유튜브 채널에 올라온 ‘주영진의 뉴스브리핑’ 영상을 신고했다는 글이 잇따라 올라왔다. 지지자들이 문제 삼은 건 지난 10일 방송된 뉴스 오프닝으로, 가수 250의 ‘휘날레’란 곡을 배경으로 대통령실이 윤 대통령의 동남아시아 순방에 MBC 기자들의 대통령 전용기 탑승을 허용하지 않았단 내용이 다뤄졌다. /SBS 공식 유튜브 캡쳐 오프닝엔 MBC가 윤 대통령의 비속어 논란을 보도했다가 여당과 대통령 측으로부터 항의를 받았단 내용도 포함됐다. 이 부분에는 ‘오늘이 그날인 것 같아. 우리가 전부였던 시간’이란 가사가 자막으로 등장했다. 또 윤 대통령과 김건희 여사가 전용기에 올라타 손을 흔드는 장면을 비롯한 여러 장면들이 흑백으로 편집됐다. 지지자들은 배경음악의 전체적인 분위기가 음산하다고 지적했다. 이들은 “추모영상에서나 쓰는 영상 기법을 왜 해외순방 가는 대통령 영상에 사용한 건지 의도가 명확해 보인다” “장송곡이 나와서 소름끼친다” 등의 반응을 보였다. 또 평소 ‘주영진의 뉴스브리핑’에서 배경음악 가사에 의미를 부여해온 점을 미뤄 “bgm 선정이 우연은 아닐 것” “휘날레란 제목도 의미가 있어 보인다” 등 반응이 나왔다. 유튜브에 올라온 해당 영상의 댓글에는 국민의힘 지지자들 사이에서 논란이 된 것과 마찬가지로 ""배경음악 왜 이러냐"" ""배경음악 소름 끼쳐. 이상하네"" 등의 반응이 올라왔다. 반면 ""오프닝 음악 좋다"" ""배경음악이 아주 잘 어울린다""는 반응도 있었다. /SBS 공식 유튜브 캡쳐 해당 배경음악은 가수 250이 지난 3월 낸 앨범 ‘뽕’에 수록된 곡이다. 영상 자막으로 쓰인 ‘오늘이 그 날인 것 같아. 우리가 전부였던 시간’은 물론 ‘이제는 너를 볼 수 없는데. 그 추억들은’이라는 가사가 여러 차례 반복된다. 또 ‘그때 우리는 함께 눈이 부신 5월의 숲길을 걷고 있었지’ ‘기다리고 있었나 봐. 우리가 눈 맞추던 자리. 그 곳에 자꾸만 너를 데려와’ 등 추억을 회상하는 내용이 담겼다. 윤석열 대통령과 김건희 여사가 한·아세안 정상회의 등의 일정을 마친 뒤 주요 20개국(G20) 정상회의가 열리는 인도네시아 발리로 출국하기 위해 13일(현지시간) 캄보디아 프놈펜국제공항에 도착, 공군 1호기에서 인사하고 있다. /연합뉴스 한편 윤석열 대통령과 조 바이든 미국 대통령, 기시다 후미오 일본 총리는 13일(현지 시간) 북한의 핵과 미사일 위협에 대응해 확장 억제를 강화하기 위한 공동성명을 채택했다. 한미일 정상은 이날 동남아국가연합(ASEAN·아세안) 정상회의 참석차 방문한 캄보디아 프놈펜에서 3각 연쇄회담을 통해 대북 압박 수위를 최고조로 끌어올렸다. 한미일 정상이 한날 한자리에서 릴레이 회동한 것은 좀처럼 보기 힘든 일이다. 정상회담 직후 3국 정상은 △북핵에 대응한 확장 억제 강화 △북한 미사일 정보 공유 의향 표명 △3국 경제안보대화체 신설 △경제적 강압에 대응하기 위한 3국 연대 △한국의 인도태평양 전략에 대한 미일 지지 △공급망 등에서의 3국 협력 강화 등을 추진한다는 내용의 공동성명을 발표했다.",https://imgnews.pstatic.net/image/011/2022/11/13/0004121612_001_20221113231901047.jpeg?type=w647,https://n.news.naver.com/mnews/article/011/0004121612?sid=100,정민수 기자,서울경제
